id,mark,mark_com,jiaoyiduifang,price,method
1843616,100%股份,中节能太阳能科技股份有限公司,中国节能、蹈德咏仁、吴姗、中新建招商、邦信资产、东方邦信创业投资有限公司、欧擎北源、王莉亚、西域红业、张奕晖、沃乾润、上海沃璞隆投资管理中心(有限合伙)、谦德咏仁、姚颖彦、深圳华禹、山南锦龙、欧擎北能、胡菊仙、中节新能、中核投资、西证阳光、招商局银科、合众建能、李金鑫,8519000000.0,收益法
1843616,全部资产和负债,桐君阁,中国节能、蹈德咏仁、吴姗、中新建招商、邦信资产、东方邦信创业投资有限公司、欧擎北源、王莉亚、西域红业、张奕晖、沃乾润、上海沃璞隆投资管理中心(有限合伙)、谦德咏仁、姚颖彦、深圳华禹、山南锦龙、欧擎北能、胡菊仙、中节新能、中核投资、西证阳光、招商局银科、合众建能、李金鑫,485200000.0,收益法
1843546,100%股权,中铁山桥,中国中铁,,资产基础法
1843546,100%股权,中铁宝桥,中国中铁,,资产基础法
1843546,100%股权,中铁科工,中国中铁,,资产基础法
1843546,100%股权,中铁装备,中国中铁,,资产基础法
1843546,全部资产和负债,中铁二局,中国中铁,,资产基础法
1843063,100%股权,同济堂医药,同济堂控股、盛世建金、西藏天然道、盛世信金、盛世坤金、卓健投资、东土宝盈、京粮鑫牛、上海燕鹤、新疆华实、倍递投资、上海沁朴、三禾元硕、三和卓健、中诚信、开元金通、广汇信、众明投资、GPC,6125713300.0,收益法
1843063,50%股权,乌苏啤酒,嘉士伯,559283800.0,资产基础法
1841798,100%股权,张家港市大伟助剂有限公司,龚卫良、勇新、黄德周、龚诚,350000000.0,收益法
1839859,"370,575,111股河北银行股份",河北银行股份有限公司,南京栖霞建设集团有限公司,1384000000.0,市场法
1839169,CX01生产线、 CX03生产线相关设备及专利技术,电子玻璃公司,彩虹集团公司,837220000.0,收益法
1838894,100%股权,江苏艾科半导体有限公司,王刚、镇江银河、高雅萍、镇江红土、深创投、南京优势、艾柯赛尔、吴江富坤、深圳红土、淮海红土、昆山红土,1080000000.0,收益法
1838013,"348,850,000股普通股",TCL多媒体,TCL多媒体科技控股有限公司,,
1837819,75%股权,宝信汽车集团有限公司,宝信投资、瑞华环球、创怡投资、宝捷投资、Schroders Plc,9467653968.46,
1835511,100%股权,乐迪网络,郭继冬、张少东、胡其玲、张莹、东方飞马,75000000.0,收益法
1835511,100%股权,雅力科技,胡靖、张南、许飞、居国进,130000000.0,收益法
1830982,50.99%的股权,吉林化工,中国吉林森林工业集团有限责任公司、吉林森工人造板集团有限责任公司,,
1830982,75%的股权,白山人造板公司,中国吉林森林工业集团有限责任公司、吉林森工人造板集团有限责任公司,,
1830982,50.99%的股权,白河刨花板公司,中国吉林森林工业集团有限责任公司、吉林森工人造板集团有限责任公司,,
1830982,100%的股权,露水河人造板公司,中国吉林森林工业集团有限责任公司、吉林森工人造板集团有限责任公司,,
1830982,与人造板业务相关的资产及负债,吉林森林工业股份有限公司,中国吉林森林工业集团有限责任公司、吉林森工人造板集团有限责任公司,,
1830024,100%股份,江苏华大,吴志明、施耿明、吴忠燕、高新投、钱月萍、章志良、沈瑞东、高华、施学明、顾卫一、李萍、胡小薇、黄建忠、黄江、袁国兵、蒋嵬、蔡建春、施永成、钱利东、黄建清、魏琴,,
1829859,100%股权,电气实业,电气总公司,,资产基础法
1829859,61%股权,上海电装,电气总公司,,资产基础法
1829859,100%股权,上鼓公司,电气总公司,,资产基础法
1829859,14.79%股权,上海轨发,电气总公司,,资产基础法
1828950,股份,中华联合保险控股股份有限公司,中国保险保障基金有限责任公司,,资产基础法
1827200,80%股权,海聆梦,邱建林、倪晨、汪方、崔竑宇、李信林、苏亚丽、刘萍、朱启锋、周兴志、张友东、黄秀国、倪震、苏州国润、杨廷栋、包文龙、何余金、上海智笙、上海景嘉、上海创丰、河北国创、周晓萍、蒋乾锐、邱醒亚、泓兆信息、新疆通海,609304000.0,收益法
1827200,100%股权,华茂进出口,华茂集团,,收益法
1827048,100%股权,申通快递有限公司,"德殷控股、陈德军,陈小英",16900000000.0,收益法
1822615,100%股权,浙江九好办公服务集团有限公司,郭丛军、杜晓芳、张勇、科桥嘉永、科桥成长、华睿海越、华睿德银、金永信、江阴安益、宁波科发、普思投资、大丰匀耀,,
1821943,100%股权,慕威时尚,张龙、王宇新、马大鹏、逄宇峰,1200000000.0,收益法
1821943,100%股权,重庆世茂影院管理有限公司等14家公司,世茂影院投资发展有限公司,1000000000.0,收益法
1820279,100%股权,北京赞成科技发展有限公司,李华、于浩洋,1100000000.0,收益法
1815837,100%股权,传化物流,传化集团、长安资管、华安资管、长城资管、中阳融正、陆家嘴基金、凯石资管(一)、西藏投资,20000000000.0,
1810383,100%股权,上海巨人网络科技有限公司,兰麟投资、鼎晖孚远、弘毅创领、孚烨投资、腾澎投资、澎腾投资、铼钸投资、中堇翊源,13090000000.0,市场法、收益法
1810383,全部资产及负债,世纪游轮,彭建虎或其指定第三方,,市场法、收益法
1809332,100%股权,深圳市拓享科技有限公司,柯志鹏、洪茂良、孙晋雄,230000000.0,收益法
1808196,100%股权,上海格蒂电力科技股份有限公司,雷厉、黎静、至佳喜公司、武汉雷石、宜兴天源、中比基金、昆山雷石、上海创祥,874000000.0,收益法
1807286,100%股权,北京赞成科技发展有限公司,李华、于浩洋,1100000000.0,
1805340,100%股权,中航复材,中航高科、航材院、制造所、北京国管中心、京国发基金,1543307300.0,资产基础法
1805340,100%股权,优材京航,航材院、中航高科、中航智控、中国航材,59839100.0,资产基础法
1805340,100%股权,优材百慕,航材院、中航高科、中航智控、中国航材,163835700.0,收益法
1805340,100%股权,通能精机,南通产控,652797400.0,资产基础法
1804924,100%股权,高升科技,于平、翁远、许磊、董艳、赵春花,,
1804564,99.9699%股权,成都富临长运集团有限公司,四川富临实业集团有限公司,962000000.0,资产基础法
1802064,85%股权,安迪苏集团,蓝星集团,,
1788204,100%的股权,新湖阳光,山东冠县鑫隆建筑材料有限公司,2171940000.0,资产基础法
1785626,耗材业务全部经营性资产,珠海赛纳打印科技股份有限公司,赛纳科技,,
1785180,100%股权,新湖阳光,山东冠县鑫隆建筑材料有限公司,2171940000.0,资产基础法
1783715,100%股权,北京联龙博通电子商务技术有限公司,刘琦、师敏龙、康军、胡宝斌、王福生、尤忠、宋诗付、刘述明、管惠娟、杨世铮、由亮、文红、吴杭州、闵群华、杨扬,530000000.0,收益法
1778072,100%股权,翔通动漫,翔运通达、四川联尔、天厚地德,1209000000.0,
1777500,100%股份,中节能太阳能科技股份有限公司,中国节能、蹈德咏仁、吴姗、中新建招商、邦信资产、东方邦信创业投资有限公司、欧擎北源、王莉亚、西域红业、张奕晖、沃乾润、上海沃璞隆投资管理中心(有限合伙)、谦德咏仁、姚颖彦、深圳华禹、山南锦龙、欧擎北能、胡菊仙、中节新能、中核投资、西证阳光、招商局银科、合众建能、李金鑫,8519000000.0,收益法
1777500,全部资产和负债,重庆桐君阁股份有限公司,合众建能、招商局银科、西证阳光、中核投资、中节新能、欧擎北能、山南锦龙、深圳华禹、谦德咏仁、沃乾润、西域红业、欧擎北源、邦信资产、中新建招商、蹈德咏仁、中国节能,485200000.0,收益法
1776907,60.93%股权,湘潭公司,大唐集团,,
1776907,35%股权,张水公司,大唐集团,,
1776907,39.07%股权,湘潭公司,地电公司,,
1776907,全部经营性资产,耒阳电厂,耒阳电厂,,
1774234,100%股权,道熙科技,龚正伟、盛真、吴荣光、盈瑞轩投资,,
1771574,100%股权,上海海尔,海尔创投、海尔智能家电、中新创投、苏州瀚科、 VPI、 CIII、 USL、上海华芯、日照常春藤、上海海咏、上海海旭、上海海仲、张晓诗、邓杰,415857300.0,收益法
1767115,全部资产和负债,桐君阁,中国节能、蹈德咏仁、吴姗、中新建招商、邦信资产、东方邦信创业投资有限公司、欧擎北源、王莉亚、西域红业、张奕晖、沃乾润、上海沃璞隆投资管理中心(有限合伙)、谦德咏仁、姚颖彦、深圳华禹、山南锦龙、欧擎北能、胡菊仙、中节新能、中核投资、西证阳光、招商局银科、合众建能、李金鑫,485200000.0,收益法
1767115,100%股份,太阳能公司,重庆太极实业(集团)股份有限公司,,
1764974,100%股权,华东设计院,现代集团,1089274100.0,收益法
1757765,80%股权,华视网聚,陈同刚、张明、周正、金永全、胡轶俊,3200000000.0,收益法
1752197,100%股权,温州益优,现代集团,465200000.0,资产基础法
1752197,100%股权,东日进出口,现代集团,,收益法
1752197,100%股权,浙江房开,现代集团,,资产基础法
1752197,60%股权,金狮房开,现代集团,,资产基础法
1727493,100%股权,安泰型钢,新泰钢铁,1399804800.0,资产基础法
1727493,51%股权,安泰冶炼,新泰钢铁,388813800.0,资产基础法
1723306,100%股权,同济堂医药,同济堂控股、盛世建金、西藏天然道、盛世信金、盛世坤金、卓健投资、东土宝盈、京粮鑫牛、上海燕鹤、新疆华实、倍递投资、上海沁朴、三禾元硕、三和卓健、中诚信、开元金通、广汇信、众明投资、GPC,6125713300.0,收益法
1723306,50%股权,乌苏啤酒,嘉士伯,559283800.0,资产基础法
1714748,100%股权,医惠科技,医惠实业、润铭投资、凯泰科技、凯泰成长、浙江海邦、瑞经达创投、华睿富华、华鸿金润、凯泰创新、旗银创投、华睿蓝石、章笠中、周明明、王福根、陈芳华、王晓烨、李季、左康、余臻、彭军、何国平、郑凌峻、王建彬、周宣、沈莉萍、黄飙,1087240000.0,收益法
1711475,100%股权,神州长城,陈略、上海金融发展、何飞燕、恒泰九鼎、海汇合赢、江西泰豪、元泰九鼎、钟山九鼎、嘉禾九鼎、鑫和泰达、吴晨曦、砻佰汇润、朱丽筠、七匹狼晟联、冯任懿、嘉源启航、何森,3068000000.0,收益法
1711475,全部资产及负债,中冠股份,陈略、上海金融发展、何飞燕、恒泰九鼎、海汇合赢、江西泰豪、元泰九鼎、钟山九鼎、嘉禾九鼎、鑫和泰达、吴晨曦、砻佰汇润、朱丽筠、七匹狼晟联、冯任懿、嘉源启航、何森,589800000.0,资产基础法
1709751,100.00%股权,南洋万邦,云赛信息(集团)有限公司、朱正文、竺军、曹彤宇、李师新、徐巧林、沈勇、朱正辉、曹云华、焦小庆、陈英俊、周英、周萍、章梦,,收益法
1709751,100.00%股权,塞嘉电子,云赛信息(集团)有限公司、杭州乾钧投资管理有限公司、上海塞嘉电子设备有限公司、宋来珠、章睿,,收益法
1709751,73.30%股权,信息网络,云赛信息(集团)有限公司,,收益法
1709751,80.00%股权,科技网络,云赛信息(集团)有限公司,,收益法
1709751,49.00%股权,卫生网络,云赛信息(集团)有限公司,,收益法
1709751,100.00%股权,宝通汎球,云赛信息(集团)有限公司,,收益法
1709751,100.00%股权,科学仪器,上海仪电电子(集团)有限公司、汤志东、殷传新、唐建华、金春法、魏乐樵、宋翔鹰、赵品杰、顾敏杰、李蕾蕾、金艳春、金建余、贾卫东、龚克文、张月芳、纪小军、余未然、顾春荣、周海勇、刘艳、吴建忠、陈灵聪,,收益法
1709751,100.00%股权,分析仪器,上海仪电电子(集团)有限公司、袁为立、黄华、薛马骏、黄庆、吴逸青、李斐斐、施雷华、何国琛、陈捷、李征、潘红霞、史玮、陈浩飞、郑亚明、闫利娟、孙圣坤、翁志祥、左向群,,收益法
1709751,100.00%股权,真空显示,仪电资产,,收益法
1709751,100.00%股权,电子印刷,仪电资产,,收益法
1708143,100%股权,雅百特,瑞鸿投资、纳贤投资、智度德诚,3497793900.0,收益法
1708143,"除5,000万元货币资金和对紫金财产保险股份有限公司2,100万元投资外的全部资产、负债",中联电气,瑞鸿投资、纳贤投资,789403800.0,成本法
1703920,100%的股权,爱德康赛,刘申、西藏爱信威诚投资管理中心(有限合伙)、哈尔滨华滨光辉创业投资企业(有限合伙),325000000.0,收益法
1699706,100%股权,南京华讯,深圳市华讯方舟科技有限公司,,收益法
1699706,100%股权,成都国蓉,深圳市华讯方舟科技有限公司,,收益法
1684627,100%股权,华东设计院,现代集团,1089274100.0,资产基础法
1682828,36.79%股权,时代沃顿,南车贵阳车辆有限公司,,
1681456,100%股权,杭州长城动漫游戏有限公司,长城集团,140000000.0,资产基础法
1681456,100%股权,湖南宏梦卡通传播有限公司,王宏、贺梦凡、浙江郡原控股有限公司、湖南汇益数码科技有限公司、徐双全,50000000.0,资产基础法
1681456,100%股权,杭州东方国龙影视动画有限公司,许妍红、张澋源,20000000.0,收益法
1681456,100%股权,北京新娱兄弟网络科技有限公司,天津一诺投资中心(有限合伙)、刘阳,500000000.0,收益法
1681456,45.74%股权,滁州长城国际动漫旅游创意园有限公司,诸暨金汇投资合伙企业(有限合伙)、富润控股集团有限公司、祥生实业集团有限公司、新湖中宝股份有限公司、浙江青苹果网络科技有限公司、赵锐均、劳洪波、徐斌、孙元兵、潘晓惠、张祖宜、沈怡、赵林中、申西杰、童超、李战、陈宝林,185000000.0,资产基础法
1681456,100%股权,上海天芮经贸有限公司,洪永刚、刘薇,81000000.0,收益法
1681456,100%股权,杭州宣诚科技有限公司,宣剑波、浙江青苹果网络科技有限公司、詹晖,40000000.0,收益法
1679379,100%股权,慕威时尚文化传播(北京)有限公司,张龙、王宇新、马大鹏、逄宇峰,1200000000.0,资产基础法
1679379,100%股权,重庆世茂影院管理有限公司,世茂影院投资发展有限公司,,资产基础法
1679379,100%股权,福州世茂影院管理有限公司,世茂影院投资发展有限公司,,资产基础法
1679379,100%股权,贵阳世茂影院管理有限公司,世茂影院投资发展有限公司,,资产基础法
1679379,100%股权,济南世茂影院管理有限公司,世茂影院投资发展有限公司,,资产基础法
1679379,100%股权,昆明世茂影院有限公司,世茂影院投资发展有限公司,,资产基础法
1679379,100%股权,昆山世茂影院管理有限公司,世茂影院投资发展有限公司,,资产基础法
1679379,100%股权,洛阳世茂影院有限公司,世茂影院投资发展有限公司,,资产基础法
1679379,100%股权,南昌世茂影院管理有限公司,世茂影院投资发展有限公司,,资产基础法
1679379,100%股权,南通世茂影院管理有限公司,世茂影院投资发展有限公司,,资产基础法
1679379,100%股权,上海虹桥世茂影院管理有限公司,世茂影院投资发展有限公司,,资产基础法
1679379,100%股权,上海世茂影院管理有限公司,世茂影院投资发展有限公司,,资产基础法
1679379,100%股权,绍兴世茂影院管理有限公司,世茂影院投资发展有限公司,,资产基础法
1679379,100%股权,苏州世茂影院管理有限公司,世茂影院投资发展有限公司,,资产基础法
1679379,100%股权,徐州世茂影院管理有限公司,世茂影院投资发展有限公司,,资产基础法
1679379,100%股权,北京世茂星辰企业管理有限公司,世茂影院投资发展有限公司,,资产基础法
1678363,90%股权,海亮环材,海亮集团,660000000.0,收益法
1674352,100%股权,传化物流集团有限公司,传化集团、长安资管、华安资管、长城资管、中阳融正、陆家嘴基金、凯石资管(一)、西藏投资,20000000000.0,收益法
1672293,100%股权,格尔木藏格钾肥股份有限公司,藏格投资、永鸿实业、肖永明、联达时代、李明、杨平、金石投资、中浩天然气、联达四方、华景君华、司浦林创投、林吉芳,9009139400.0,资产基础法
1672293,扣除货币资金的全部资产负债,金谷源控股股份有限公司,藏格兴恒,155820700.0,资产基础法
1672209,100%股权,台海核电,台海集团、深圳金石源、上海开拓、挚信合能、冠鹿创富、维思捷宝、天津维劲、泉韵金属、旭日东方、深圳正轩、祥隆集团、烟台丰华、北京美锦、虞锋、张维、陈勇、陈云昌、王月永、王雪欣、叶国蔚、姜明杰、李政军、黄永钢、刘仲礼、王根启、隋秀梅、梅洪生、张翔、赵天明、汪欣、刘昕炜、初宇、林岩、于海燕、孙恒、林洪宁、张礼、由明江、徐志强、张世良、张天刚、马焕玲、白山、孙培崇、吴作伟、徐小波、李仁平,3146000000.0,收益法
1672209,"截至评估基准日合法拥有的除38,003.61万元不构成业务的资产以外的全部资产和负债",丹甫股份,台海核电,397708500.0,资产基础法
1671738,100.00%股权,广汇汽车,新疆广汇实业投资(集团)有限责任公司、 China Grand Automotive( Mauritius) Limited、鹰潭市锦胜投资有限合伙企业、天津正和世通股权投资基金合伙企业(有限合,23577250000.0,
1671738,除可供出售金融资产外全部资产和负债,美罗药业股份有限公司,,749000000.0,
1670015,100%股权,尚世影业,文广集团、北京弘毅、文化产业基金、上海联新、黄建新、张小童、陈澍,,
1670015,68.0672%股权,文广互动,文广集团,,
1670015,45.2118%股权,东方希杰,"文广集团、亿友商贸、同方创投、同利创投、 Homeland Evolvement Limited、 CHS Holdings Ltd.、 Tai Shan Capital I,Limited、",,
1670015,100%股权,五岸传播,,,
1669816,100%股权,海斯福,王陈锋、曹伟、朱吉洪、谢伟东、吕涛、张威,,
1667325,100%股权,传化物流,传化集团、长安资管、华安资管、长城资管、中阳融正、陆家嘴基金、凯石资管(一)、西藏投资,20000000000.0,收益法
1666147,100%股权,格蒂电力,雷厉、黎静、至佳喜公司、武汉雷石、宜兴天源、中比基金、昆山雷石、上海创祥,874000000.0,收益法
1665901,100%的股权,深圳市玉龙宫实业发展有限公司,中兴建设有限公司,320000000.0,资产基础法
1665901,100%的股权,深圳市鑫龙海置业有限公司,万泽集团有限公司,58000000.0,资产基础法
1665297,100%股权,南京华讯,深圳市华讯方舟科技有限公司,1709445800.0,收益法
1665297,100%股权,成都国蓉,深圳市华讯方舟科技有限公司,1709445800.0,收益法
1665297,传统业务相关的资产及负债(包括或有负债),恒天天鹅,深圳市华讯方舟科技有限公司,1082092600.0,
1663215,100%股权,上海海能,卓斌、冒晓建、徐正敏、朱玥奋、徐迪、祝轲卿、卓欢、梁锋,1100000000.0,
1663215,100%股权,德沃仕,杭开电气、曹冠晖、吴宝才、金石灏汭、马文奇、吴进山、浙江德石,245000000.0,
1661244,100%股权,顶立科技,顶立汇智、冠西投资、贯丰投资、汇能投资、汇德投资、富德投资、华菱津杉、富德泰懋、科技风投、刘刚、罗静玲、丁灿、吴霞、孙辉伟、罗新伟,520000000.0,收益法
1657123,100%股权,大伟助剂,龚卫良、勇新、黄德周、龚诚,350000000.0,收益法
1655063,98%股权,健坤物业,当代集团,146688200.0,资产基础法
1655063,80%股权,恒裕矿业,当代集团,29530700.0,资产基础法
1647230,100%股权,中国有色金属工业再生资源有限公司,大连大显集团有限公司,770000000.0,资产基础法
1642142,100%股权,八达园林,王仁年、博正资本、重庆西证、重庆贝信、常州世通、苏州东方、杭州富庆、广州海汇、上海雅银、天津百富源、韶关粤商、李文龙、余艳平、王建明、潘永兴、吴克忠、王云杰、刘健、夏海平、王云姗、王文明、王明荣、郭宏平、蒋春华、张小江、蒋卫冠、曹伟光、钱云亚、汤春荣、陈亚琴、黄玲霞、尹兰军、周余、陈亚平、孙宏章、胡六一、朱燕、李康生、许大雄、王建荣、周春华、闵伟平、李彪、张望龙、吴印、陈元华、沈壹峰,1660000000.0,收益法
1638091,100%股权,中闽能源,投资集团、海峡投资、大同创投、复星创富、红桥新能源、铁路投资、华兴创投,,
1638091,全部资产与负债,福建南纸,投资集团,,
1637561,100%的股权,医惠科技有限公司,润铭投资、凯泰科技、凯泰成长、浙江海邦、瑞经达创投、华睿富华、华鸿金润、凯泰创新、旗银创投、华睿蓝石、章笠中、周明明、王福根、陈芳华、王晓烨、李季、左康、余臻、彭军、何国平、郑凌峻、王建彬、周宣、沈莉,1087240000.0,收益法
1635912,85.00%股权,双良新能源,双良科技、利创新能源,364584400.0,收益法
1635912,75.00%股权,利士德化工,双良科技、利创新能,364584400.0,资产基础法
1635746,100%股权,洛阳公司,中再生、中再资源、黑龙江中再生、山东中再生、华清再生、湖北再生、四川农资、唐山再生、君诚投资、刘永彬、郇庆明,,收益法
1635746,100%股权,四川公司,中再生、中再资源、黑龙江中再生、山东中再生、华清再生、湖北再生、四川农资、唐山再生、君诚投资、刘永彬、郇庆明,,收益法
1635746,100%股权,唐山公司,中再生、中再资源、黑龙江中再生、山东中再生、华清再生、湖北再生、四川农资、唐山再生、君诚投资、刘永彬、郇庆明,,收益法
1635746,100%股权,江西公司,中再生、中再资源、黑龙江中再生、山东中再生、华清再生、湖北再生、四川农资、唐山再生、君诚投资、刘永彬、郇庆明,,收益法
1635746,100%股权,黑龙江公司,中再生、中再资源、黑龙江中再生、山东中再生、华清再生、湖北再生、四川农资、唐山再生、君诚投资、刘永彬、郇庆明,,收益法
1635746,100%股权,蕲春公司,中再生、中再资源、黑龙江中再生、山东中再生、华清再生、湖北再生、四川农资、唐山再生、君诚投资、刘永彬、郇庆明,,收益法
1635746,100%股权,广东公司,中再生、中再资源、黑龙江中再生、山东中再生、华清再生、湖北再生、四川农资、唐山再生、君诚投资、刘永彬、郇庆明,,收益法
1635746,56%股权,山东公司,中再生、中再资源、黑龙江中再生、山东中再生、华清再生、湖北再生、四川农资、唐山再生、君诚投资、刘永彬、郇庆明,,收益法
1635746,全部资产(含负债),陕西秦岭水泥(集团)股份有限公司,冀东水泥,,收益法
1634966,53.125%股权,北京三吉利股份有限公司,国利能源、华电金泰、桂清投资,1275000000.0,
1633583,100%股权,中再资源,大显集团,770000000.0,资产基础法
1631480,100%股权,北京华夏电通科技股份有限公司,栗军、李俊峰、张思必、蒋国兴、贾瑞明、谢泳江、李建、贾高勇、周明浩、夏郁葱、孙莉、赵月军、单衍景、王瑞宾、王平、胡雷、杨建军、房兰花、刘枫、曹艳中、李行、郭武、张锐锋、高翔、杨颖、邹康、姚立生、陈皞玥、卢昌、于大泳、白锐、仝敬明、陈亮、刘海滨、刘卫国、王邦新、梅志勇、肖冰、杨楠、李悦、郭辉、郭超、夏永强、张晓丽、杨怀兵、陈彪、苏州易联、达晨银雷、辰光致远,600000000.0,收益法
1628679,100%股权,华东建筑设计研究院有限公司,上海现代建筑设计(集团)有限公司,1089274100.0,收益法
1628679,全部资产和负债,上海棱光实业股份有限公司,上海现代建筑设计(集团)有限公司,969269000.0,资产基础法
1622727,100%股权,医惠科技,医惠实业、润铭投资、凯泰科技、凯泰成长、浙江海邦、瑞经达创投、华睿富华、华鸿金润、凯泰创新、旗银创投、华睿蓝石、章笠中、周明明、王福根、陈芳华、王晓烨、李季、左康、余臻、彭军、何国平、郑凌峻、王建彬、周宣、沈莉萍、黄飙,1087240000.0,收益法
1620261,89.77%股权,同路生物,科瑞金鼎、深圳莱士、谢燕玲,,
1605284,100%股权,游唐网络,仲杨、陆旻、韩军、上海完美、苏州龙跃,562500000.0,
1595355,100%股权,中闽能源,投资集团、海峡投资、大同创投、复星创富、红桥新能源、铁路投资、华兴创投,1175122300.0,收益法
1595355,全部资产和负债,福建南纸,投资集团,575833800.0,资产基础法
1594374,100%股权,华东建筑设计研究院有限公司,上海现代建筑设计(集团)有限公司,1089274100.0,收益法
1594374,全部资产和负债,棱光实业,上海现代建筑设计(集团)有限公司,969269000.0,资产基础法
